{"counts":{"assertions":{"failed":1,"total":6},"caseRuns":{"cancelled":0,"error":0,"failed":1,"passed":2,"skipped":0,"timedOut":0,"total":3}},"durationMs":20.405,"language":"2.0","outcome":"failed","result":"jtest-run","resultVersion":"2.0.0","runId":"20260727T171400868Z-be03723b","startUtc":"2026-07-27T17:14:00.868Z","toolVersion":"2.0.0-alpha.1","trace":{"children":[{"children":[{"children":[{"children":[{"children":[{"children":[{"durationMs":0,"evidence":{"actual":5,"expected":0,"message":"","op":"greaterThan"},"kind":"assertion","name":"stock is positive","ordinal":1,"outcome":"passed","path":"suites/0/cases/0/steps/0/iterations/0/steps/0/assertions/0","startUtc":"0001-01-01T00:00:00.000Z"}],"durationMs":4.118,"kind":"step","ordinal":1,"outcome":"passed","path":"suites/0/cases/0/steps/0/iterations/0/steps/0","startUtc":"2026-07-27T17:14:00.877Z","stepType":"assert"}],"durationMs":5.007,"evidence":{"item":5},"iterationIndex":0,"kind":"iteration","ordinal":1,"outcome":"passed","path":"suites/0/cases/0/steps/0/iterations/0","startUtc":"2026-07-27T17:14:00.877Z"},{"children":[{"children":[{"durationMs":0,"evidence":{"actual":12,"expected":0,"message":"","op":"greaterThan"},"kind":"assertion","name":"stock is positive","ordinal":1,"outcome":"passed","path":"suites/0/cases/0/steps/0/iterations/1/steps/0/assertions/0","startUtc":"0001-01-01T00:00:00.000Z"}],"durationMs":0.025,"kind":"step","ordinal":1,"outcome":"passed","path":"suites/0/cases/0/steps/0/iterations/1/steps/0","startUtc":"2026-07-27T17:14:00.882Z","stepType":"assert"}],"durationMs":0.042,"evidence":{"item":12},"iterationIndex":1,"kind":"iteration","ordinal":2,"outcome":"passed","path":"suites/0/cases/0/steps/0/iterations/1","startUtc":"2026-07-27T17:14:00.882Z"},{"children":[{"children":[{"durationMs":0,"evidence":{"actual":42,"expected":0,"message":"","op":"greaterThan"},"kind":"assertion","name":"stock is positive","ordinal":1,"outcome":"passed","path":"suites/0/cases/0/steps/0/iterations/2/steps/0/assertions/0","startUtc":"0001-01-01T00:00:00.000Z"}],"durationMs":0.004,"kind":"step","ordinal":1,"outcome":"passed","path":"suites/0/cases/0/steps/0/iterations/2/steps/0","startUtc":"2026-07-27T17:14:00.882Z","stepType":"assert"}],"durationMs":0.006,"evidence":{"item":42},"iterationIndex":2,"kind":"iteration","ordinal":3,"outcome":"passed","path":"suites/0/cases/0/steps/0/iterations/2","startUtc":"2026-07-27T17:14:00.882Z"}],"durationMs":7.619,"kind":"step","name":"Check quantities","ordinal":1,"outcome":"passed","path":"suites/0/cases/0/steps/0","startUtc":"2026-07-27T17:14:00.874Z","stepType":"for"},{"durationMs":5.416,"evidence":{"requestedMs":0},"kind":"step","ordinal":2,"outcome":"passed","path":"suites/0/cases/0/steps/1","startUtc":"2026-07-27T17:14:00.882Z","stepType":"wait"},{"children":[{"durationMs":0,"evidence":{"actual":3,"expected":3,"message":"","op":"equals"},"kind":"assertion","ordinal":1,"outcome":"passed","path":"suites/0/cases/0/steps/2/assertions/0","startUtc":"0001-01-01T00:00:00.000Z"}],"durationMs":0.197,"kind":"step","name":"All quantities checked","ordinal":3,"outcome":"passed","path":"suites/0/cases/0/steps/2","startUtc":"2026-07-27T17:14:00.887Z","stepType":"assert"}],"durationMs":14.095,"kind":"case","name":"inventory invariants","ordinal":1,"outcome":"passed","path":"suites/0/cases/0","startUtc":"2026-07-27T17:14:00.873Z"},{"children":[{"children":[{"children":[{"durationMs":0,"evidence":{"actual":10,"expected":15,"message":"","op":"lessOrEqual"},"kind":"assertion","name":"price within budget","ordinal":1,"outcome":"passed","path":"suites/0/cases/1/datasets/0/steps/0/assertions/0","startUtc":"0001-01-01T00:00:00.000Z"}],"durationMs":0.025,"kind":"step","name":"Tier price stays within budget","ordinal":1,"outcome":"passed","path":"suites/0/cases/1/datasets/0/steps/0","startUtc":"2026-07-27T17:14:00.888Z","stepType":"assert"}],"dataset":"basic","durationMs":0.238,"kind":"datasetRun","name":"pricing by tier [basic]","ordinal":1,"outcome":"passed","path":"suites/0/cases/1/datasets/0","startUtc":"2026-07-27T17:14:00.888Z"},{"children":[{"children":[{"durationMs":0,"evidence":{"actual":30,"expected":25,"message":"Expected lessOrEqual to hold; actual was 30 and expected operand was 25.","op":"lessOrEqual"},"kind":"assertion","name":"price within budget","ordinal":1,"outcome":"failed","path":"suites/0/cases/1/datasets/1/steps/0/assertions/0","startUtc":"0001-01-01T00:00:00.000Z"}],"durationMs":0.41,"kind":"step","name":"Tier price stays within budget","ordinal":1,"outcome":"failed","path":"suites/0/cases/1/datasets/1/steps/0","startUtc":"2026-07-27T17:14:00.888Z","stepType":"assert"}],"dataset":"premium","durationMs":0.414,"kind":"datasetRun","name":"pricing by tier [premium]","ordinal":2,"outcome":"failed","path":"suites/0/cases/1/datasets/1","startUtc":"2026-07-27T17:14:00.888Z"}],"durationMs":0.717,"kind":"case","name":"pricing by tier","ordinal":2,"outcome":"failed","path":"suites/0/cases/1","startUtc":"2026-07-27T17:14:00.887Z"}],"durationMs":17.715,"evidence":{"source":"example.suite.json"},"kind":"suite","name":"Order lifecycle","ordinal":1,"outcome":"failed","path":"suites/0","startUtc":"2026-07-27T17:14:00.870Z"}],"durationMs":20.405,"kind":"run","ordinal":1,"outcome":"failed","path":"","startUtc":"2026-07-27T17:14:00.868Z"}}